[
  {
    "schema_version": "2.0.0",
    "record_type": "compliance_report",
    "report_id": "g20.2024.rio.final.compliance",
    "institution": "G20",
    "summit_id": "G20.rio.2024",
    "report_stage": "final",
    "assessment_window_start": "2024-11-20",
    "assessment_window_end": "2025-08-20",
    "publication_date": "2025-11-18",
    "supersedes_report_id": null,
    "source_document_id": "g20.2024-rio.final.report",
    "parser_version": "g20-2024-rio-adapter@2.0.0",
    "retrieval_date": "2026-07-24",
    "extraction_warnings": ["cover_window_end_differs:2025-11-05"]
  },
  {
    "schema_version": "2.0.0",
    "record_type": "compliance_report",
    "report_id": "g20.2024.rio.interim.compliance",
    "institution": "G20",
    "summit_id": "G20.rio.2024",
    "report_stage": "interim",
    "assessment_window_start": "2024-11-20",
    "assessment_window_end": "2025-05-31",
    "publication_date": "2025-09-16",
    "supersedes_report_id": null,
    "source_document_id": "g20.2024-rio.interim.report",
    "parser_version": "g20-2024-rio-adapter@2.0.0",
    "retrieval_date": "2026-07-24",
    "extraction_warnings": []
  }
]
